{
  "version": 3,
  "generated_at": "2026-02-15T23:29:43.561553+00:00",
  "industry": "aviation",
  "alias_registry": {
    "path": "config/router/alias_registry/aviation_column_aliases.json",
    "total_aliases": 0,
    "approved_aliases": 0,
    "candidate_aliases": 0,
    "rejected_aliases": 0,
    "canonical_to_aliases": {}
  },
  "categories": [
    {
      "category": "customer",
      "task_type": "classification",
      "keywords": [
        "review",
        "sentiment",
        "satisfaction",
        "rating",
        "feedback",
        "nps",
        "complaint"
      ],
      "worker_count": 7,
      "prepared_worker_count": 8,
      "workers": [
        {
          "worker_model_id": "l0_kaggle_airline_passenger_satisfaction",
          "worker_dataset_id": "kaggle_airline_passenger_satisfaction",
          "task_type": "classification",
          "passed_benchmark": true,
          "target_column": "satisfaction",
          "n_features": 28,
          "paths": {
            "model_path": "models/aviation/L0/l0_kaggle_airline_passenger_satisfaction.joblib",
            "data_file": "data/processed/aviation/customer/kaggle_airline_passenger_satisfaction.parquet.zstd",
            "feature_metadata_path": "models/aviation/L0/l0_kaggle_airline_passenger_satisfaction_fe.json"
          },
          "columns": {
            "model_feature_columns": [
              "",
              "Gender",
              "Customer Type",
              "Age",
              "Type of Travel",
              "Class",
              "Flight Distance",
              "Inflight wifi service",
              "Departure/Arrival time convenient",
              "Ease of Online booking",
              "Gate location",
              "Food and drink",
              "Online boarding",
              "Seat comfort",
              "Inflight entertainment",
              "On-board service",
              "Leg room service",
              "Baggage handling",
              "Checkin service",
              "Inflight service",
              "Cleanliness",
              "Departure Delay in Minutes",
              "Arrival Delay in Minutes"
            ],
            "dataset_columns": [
              "",
              "id",
              "Gender",
              "Customer Type",
              "Age",
              "Type of Travel",
              "Class",
              "Flight Distance",
              "Inflight wifi service",
              "Departure/Arrival time convenient",
              "Ease of Online booking",
              "Gate location",
              "Food and drink",
              "Online boarding",
              "Seat comfort",
              "Inflight entertainment",
              "On-board service",
              "Leg room service",
              "Baggage handling",
              "Checkin service",
              "Inflight service",
              "Cleanliness",
              "Departure Delay in Minutes",
              "Arrival Delay in Minutes",
              "satisfaction"
            ],
            "synonyms": {
              "canonical_to_aliases": {},
              "alias_to_canonical": {}
            },
            "feature_metadata": {
              "kept_columns": [
                "",
                "Gender_Female",
                "Gender_Male",
                "Customer Type_Loyal Customer",
                "Customer Type_disloyal Customer",
                "Age",
                "Type of Travel_Business travel",
                "Type of Travel_Personal Travel",
                "Class_Business",
                "Class_Eco",
                "Class_Eco Plus",
                "Flight Distance",
                "Inflight wifi service",
                "Departure/Arrival time convenient",
                "Ease of Online booking",
                "Gate location",
                "Food and drink",
                "Online boarding",
                "Seat comfort",
                "Inflight entertainment",
                "On-board service",
                "Leg room service",
                "Baggage handling",
                "Checkin service",
                "Inflight service",
                "Cleanliness",
                "Departure Delay in Minutes",
                "Arrival Delay in Minutes"
              ],
              "dropped_columns": [],
              "dummy_columns": [
                "Gender_Female",
                "Gender_Male",
                "Customer Type_Loyal Customer",
                "Customer Type_disloyal Customer",
                "Type of Travel_Business travel",
                "Type of Travel_Personal Travel",
                "Class_Business",
                "Class_Eco",
                "Class_Eco Plus"
              ],
              "encoded_columns": [],
              "text_feature_columns": []
            }
          },
          "spec_target": {
            "target_column": "satisfaction",
            "target_task_type": "classification",
            "derived_target_name": null,
            "gating": null
          }
        },
        {
          "worker_model_id": "l0_mendeley_airline_reviews_sentiment",
          "worker_dataset_id": "mendeley_airline_reviews_sentiment",
          "task_type": "classification",
          "passed_benchmark": true,
          "target_column": "sentiment",
          "n_features": 131,
          "paths": {
            "model_path": "models/aviation/L0/l0_mendeley_airline_reviews_sentiment.joblib",
            "data_file": "data/processed/aviation/customer/mendeley_airline_reviews_sentiment.parquet.zstd",
            "feature_metadata_path": "models/aviation/L0/l0_mendeley_airline_reviews_sentiment_fe.json"
          },
          "columns": {
            "model_feature_columns": [
              "review",
              "title",
              "rating",
              "recommended"
            ],
            "dataset_columns": [
              "review",
              "title",
              "rating",
              "recommended",
              "sentiment"
            ],
            "synonyms": {
              "canonical_to_aliases": {},
              "alias_to_canonical": {}
            },
            "feature_metadata": {
              "kept_columns": [
                "rating",
                "recommended_no",
                "recommended_yes"
              ],
              "dropped_columns": [
                "review",
                "title"
              ],
              "dummy_columns": [
                "recommended_no",
                "recommended_yes"
              ],
              "encoded_columns": [],
              "text_feature_columns": [
                "review",
                "title"
              ]
            }
          },
          "spec_target": {
            "target_column": "sentiment",
            "target_task_type": "classification",
            "derived_target_name": null,
            "gating": null
          }
        },
        {
          "worker_model_id": "l0_skytrax_airline_reviews",
          "worker_dataset_id": "skytrax_airline_reviews",
          "task_type": "classification",
          "passed_benchmark": true,
          "target_column": "recommended",
          "n_features": 295,
          "paths": {
            "model_path": "models/aviation/L0/l0_skytrax_airline_reviews.joblib",
            "data_file": "data/processed/aviation/customer/skytrax_airline_reviews.parquet.zstd",
            "feature_metadata_path": "models/aviation/L0/l0_skytrax_airline_reviews_fe.json"
          },
          "columns": {
            "model_feature_columns": [
              "airline_name",
              "link",
              "title",
              "author",
              "author_country",
              "date",
              "content",
              "aircraft",
              "type_traveller",
              "cabin_flown",
              "route",
              "overall_rating",
              "seat_comfort_rating",
              "cabin_staff_rating",
              "food_beverages_rating",
              "inflight_entertainment_rating",
              "ground_service_rating",
              "wifi_connectivity_rating",
              "value_money_rating"
            ],
            "dataset_columns": [
              "airline_name",
              "link",
              "title",
              "author",
              "author_country",
              "date",
              "content",
              "aircraft",
              "type_traveller",
              "cabin_flown",
              "route",
              "overall_rating",
              "seat_comfort_rating",
              "cabin_staff_rating",
              "food_beverages_rating",
              "inflight_entertainment_rating",
              "ground_service_rating",
              "wifi_connectivity_rating",
              "value_money_rating",
              "recommended"
            ],
            "synonyms": {
              "canonical_to_aliases": {},
              "alias_to_canonical": {}
            },
            "feature_metadata": {
              "kept_columns": [
                "airline_name",
                "author_country",
                "date",
                "aircraft",
                "type_traveller_Business",
                "type_traveller_Couple Leisure",
                "type_traveller_FamilyLeisure",
                "type_traveller_Solo Leisure",
                "type_traveller_unknown",
                "cabin_flown_Business Class",
                "cabin_flown_Economy",
                "cabin_flown_First Class",
                "cabin_flown_Premium Economy",
                "cabin_flown_unknown",
                "route",
                "overall_rating",
                "seat_comfort_rating",
                "cabin_staff_rating",
                "food_beverages_rating",
                "inflight_entertainment_rating_0.0",
                "inflight_entertainment_rating_1.0",
                "inflight_entertainment_rating_2.0",
                "inflight_entertainment_rating_3.0",